{"$schema":"https://json-schema.org/draft/2020-12/schema","$id":"voce.visual-composition-catalog/v1alpha1","type":"object","required":["schemaVersion","id","paths","presets","catalogHash"],"properties":{"schemaVersion":{"const":"voce.visual-composition/v1alpha1"},"id":{"type":"string"},"paths":{"type":"array","items":{"$ref":"voce.ontology-path-definition/v1alpha1"}},"presets":{"type":"array","items":{"$ref":"voce.visual-composition-preset/v1alpha1"}},"catalogHash":{"type":"string","pattern":"^sha256:[0-9a-f]{64}$"}},"additionalProperties":false}
