{
  "schemaVersion": "voce.visual-composition/v1alpha1",
  "id": "visual-composition.v1",
  "paths": [
    { "path": "camera.framing.shotScale", "valueKind": "enum", "cardinality": "one", "allowedValues": ["extreme_close_up", "close_up", "head_and_shoulders", "bust_shot", "medium_close_up", "medium_shot", "knee_shot", "full_shot", "long_shot", "extreme_long_shot"], "defaultImportance": "preferred" },
    { "path": "camera.framing.crop.keepHead", "valueKind": "boolean", "cardinality": "one", "defaultImportance": "preferred" },
    { "path": "camera.framing.crop.keepHands", "valueKind": "boolean", "cardinality": "one", "defaultImportance": "preferred" },
    { "path": "camera.framing.crop.keepBothFeet", "valueKind": "boolean", "cardinality": "one", "defaultImportance": "preferred" },
    { "path": "camera.framing.crop.keepProduct", "valueKind": "boolean", "cardinality": "one", "defaultImportance": "preferred" },
    { "path": "camera.framing.crop.keepSignatureProp", "valueKind": "boolean", "cardinality": "one", "defaultImportance": "preferred" },
    { "path": "camera.view.elevation", "valueKind": "enum", "cardinality": "one", "allowedValues": ["eye_level", "low_angle", "high_angle", "birds_eye"], "defaultImportance": "preferred" },
    { "path": "camera.view.relationship", "valueKind": "enum", "cardinality": "one", "allowedValues": ["front", "three_quarter", "profile", "rear", "over_the_shoulder"], "defaultImportance": "preferred" },
    { "path": "camera.roll.mode", "valueKind": "enum", "cardinality": "one", "allowedValues": ["level", "dutch_left", "dutch_right"], "defaultImportance": "preferred" },
    { "path": "camera.lens.focalLengthClass", "valueKind": "enum", "cardinality": "one", "allowedValues": ["ultra_wide", "wide", "normal", "telephoto", "super_telephoto"], "defaultImportance": "preferred" },
    { "path": "camera.lens.perspective", "valueKind": "enum", "cardinality": "one", "allowedValues": ["expanded", "natural", "compressed"], "defaultImportance": "preferred" },
    { "path": "camera.composition.patterns.centeredSymmetry", "valueKind": "boolean", "cardinality": "one", "defaultImportance": "preferred" },
    { "path": "camera.composition.patterns.ruleOfThirds", "valueKind": "boolean", "cardinality": "one", "defaultImportance": "preferred" },
    { "path": "camera.composition.patterns.leadingLines", "valueKind": "boolean", "cardinality": "one", "defaultImportance": "preferred" },
    { "path": "camera.composition.patterns.diagonal", "valueKind": "boolean", "cardinality": "one", "defaultImportance": "preferred" },
    { "path": "camera.composition.patterns.sCurve", "valueKind": "boolean", "cardinality": "one", "defaultImportance": "preferred" },
    { "path": "camera.composition.patterns.triangle", "valueKind": "boolean", "cardinality": "one", "defaultImportance": "preferred" },
    { "path": "camera.composition.placement", "valueKind": "enum", "cardinality": "one", "allowedValues": ["center", "left_third", "right_third", "upper_third", "lower_third"], "defaultImportance": "preferred" },
    { "path": "camera.composition.negativeSpace", "valueKind": "enum", "cardinality": "one", "allowedValues": ["none", "left", "right", "above", "below", "surrounding"], "defaultImportance": "preferred" },
    { "path": "camera.composition.leadingRoom.enabled", "valueKind": "boolean", "cardinality": "one", "defaultImportance": "preferred" },
    { "path": "camera.composition.leadingRoom.direction", "valueKind": "enum", "cardinality": "one", "allowedValues": ["left", "right", "forward", "up", "down"], "defaultImportance": "preferred" },
    { "path": "camera.composition.foregroundTreatment", "valueKind": "enum", "cardinality": "one", "allowedValues": ["clear", "soft_obstruction", "strong_obstruction"], "defaultImportance": "preferred" },
    { "path": "camera.composition.framingDevices.frameWithinFrame", "valueKind": "boolean", "cardinality": "one", "defaultImportance": "preferred" },
    { "path": "camera.composition.framingDevices.environmentalPortrait", "valueKind": "boolean", "cardinality": "one", "defaultImportance": "preferred" },
    { "path": "camera.composition.reflection.enabled", "valueKind": "boolean", "cardinality": "one", "defaultImportance": "preferred" },
    { "path": "camera.composition.reflection.surface", "valueKind": "enum", "cardinality": "one", "allowedValues": ["mirror", "glass", "water", "screen", "polished_surface"], "defaultImportance": "preferred" },
    { "path": "camera.composition.reflection.role", "valueKind": "enum", "cardinality": "one", "allowedValues": ["supporting", "co_primary", "primary"], "defaultImportance": "preferred" },
    { "path": "camera.composition.environmentRelationship", "valueKind": "enum", "cardinality": "one", "allowedValues": ["isolated", "contextual", "environment_dominant"], "defaultImportance": "preferred" },
    { "path": "lighting.subjectRendering", "valueKind": "enum", "cardinality": "one", "allowedValues": ["natural", "silhouette"], "defaultImportance": "preferred" }
  ],
  "presets": [
    { "id": "extreme-close-up", "labelKey": "visualComposition.extreme-close-up.label", "descriptionKey": "visualComposition.extreme-close-up.description", "category": "framing", "changes": [{ "operation": "replace", "targetPath": "camera.framing.shotScale", "requestedValue": "extreme_close_up" }] },
    { "id": "close-up", "labelKey": "visualComposition.close-up.label", "descriptionKey": "visualComposition.close-up.description", "category": "framing", "changes": [{ "operation": "replace", "targetPath": "camera.framing.shotScale", "requestedValue": "close_up" }] },
    { "id": "head-and-shoulders", "labelKey": "visualComposition.head-and-shoulders.label", "descriptionKey": "visualComposition.head-and-shoulders.description", "category": "framing", "changes": [{ "operation": "replace", "targetPath": "camera.framing.shotScale", "requestedValue": "head_and_shoulders" }, { "operation": "adjust", "targetPath": "camera.framing.crop.keepHead", "requestedValue": true }] },
    { "id": "bust-shot", "labelKey": "visualComposition.bust-shot.label", "descriptionKey": "visualComposition.bust-shot.description", "category": "framing", "changes": [{ "operation": "replace", "targetPath": "camera.framing.shotScale", "requestedValue": "bust_shot" }, { "operation": "adjust", "targetPath": "camera.framing.crop.keepHead", "requestedValue": true }] },
    { "id": "medium-close-up", "labelKey": "visualComposition.medium-close-up.label", "descriptionKey": "visualComposition.medium-close-up.description", "category": "framing", "changes": [{ "operation": "replace", "targetPath": "camera.framing.shotScale", "requestedValue": "medium_close_up" }] },
    { "id": "medium-shot", "labelKey": "visualComposition.medium-shot.label", "descriptionKey": "visualComposition.medium-shot.description", "category": "framing", "changes": [{ "operation": "replace", "targetPath": "camera.framing.shotScale", "requestedValue": "medium_shot" }] },
    { "id": "knee-shot", "labelKey": "visualComposition.knee-shot.label", "descriptionKey": "visualComposition.knee-shot.description", "category": "framing", "changes": [{ "operation": "replace", "targetPath": "camera.framing.shotScale", "requestedValue": "knee_shot" }] },
    { "id": "full-shot", "labelKey": "visualComposition.full-shot.label", "descriptionKey": "visualComposition.full-shot.description", "category": "framing", "changes": [{ "operation": "replace", "targetPath": "camera.framing.shotScale", "requestedValue": "full_shot" }, { "operation": "adjust", "targetPath": "camera.framing.crop.keepBothFeet", "requestedValue": true }] },
    { "id": "long-shot", "labelKey": "visualComposition.long-shot.label", "descriptionKey": "visualComposition.long-shot.description", "category": "framing", "changes": [{ "operation": "replace", "targetPath": "camera.framing.shotScale", "requestedValue": "long_shot" }, { "operation": "adjust", "targetPath": "camera.composition.environmentRelationship", "requestedValue": "contextual" }] },
    { "id": "extreme-long-shot", "labelKey": "visualComposition.extreme-long-shot.label", "descriptionKey": "visualComposition.extreme-long-shot.description", "category": "framing", "changes": [{ "operation": "replace", "targetPath": "camera.framing.shotScale", "requestedValue": "extreme_long_shot" }, { "operation": "adjust", "targetPath": "camera.composition.environmentRelationship", "requestedValue": "environment_dominant" }] },
    { "id": "low-angle", "labelKey": "visualComposition.low-angle.label", "descriptionKey": "visualComposition.low-angle.description", "category": "view", "changes": [{ "operation": "adjust", "targetPath": "camera.view.elevation", "requestedValue": "low_angle" }] },
    { "id": "high-angle", "labelKey": "visualComposition.high-angle.label", "descriptionKey": "visualComposition.high-angle.description", "category": "view", "changes": [{ "operation": "adjust", "targetPath": "camera.view.elevation", "requestedValue": "high_angle" }] },
    { "id": "birds-eye-view", "labelKey": "visualComposition.birds-eye-view.label", "descriptionKey": "visualComposition.birds-eye-view.description", "category": "view", "changes": [{ "operation": "adjust", "targetPath": "camera.view.elevation", "requestedValue": "birds_eye" }] },
    { "id": "over-the-shoulder", "labelKey": "visualComposition.over-the-shoulder.label", "descriptionKey": "visualComposition.over-the-shoulder.description", "category": "view", "compatibilityHints": ["foreground-shoulder-subject-or-declared-equivalent"], "changes": [{ "operation": "adjust", "targetPath": "camera.view.relationship", "requestedValue": "over_the_shoulder" }] },
    { "id": "dutch-angle", "labelKey": "visualComposition.dutch-angle.label", "descriptionKey": "visualComposition.dutch-angle.description", "category": "view", "requiredInputs": ["direction"], "changes": [{ "operation": "adjust", "targetPath": "camera.roll.mode", "valueFrom": "direction" }] },